{"acceptance":{"command":["/usr/bin/python3.12","-B","-c","from requests.utils import prepend_scheme_if_needed; assert prepend_scheme_if_needed('http://user:pass@example.com/path?query','http') == 'http://user:pass@example.com/path?query'"],"timeout_seconds":120},"blind_gold":{"policy":"unavailable_to_runtime"},"budgets":{"max_total_tokens":2000000,"max_wall_time_seconds":10800,"soft_warning_ratio":0.8,"stop_boundaries":["pre_provider_launch","post_invocation_terminal","pre_integration","post_integration"]},"direct_taskpack":{"available_to_full_mode":false,"cost_reported_separately":true,"sha256":"59eaab2d00d61f4c26365c563d1e106c8f8c3f712af4095cc2a6d06e4fa672a8"},"environment":{"backend":"codex","codex_cli_version":"codex-cli 0.147.0","cpu_limit":4,"dependency_cache_policy":"host-read-only","host_class":"local-rootless-linux-x86_64","max_inflight_model_invocations":1,"memory_limit_bytes":8589934592,"model":"gpt-5.6-sol","network_policy":"provider_access","permission_policy":"never","reasoning_profile":"high","sandbox_policy":"workspace-write","service_configuration_sha256":"c8e0e5ff80e04ee0aec01d82173a774a44cddedc2aace4f076dbc422869119b0","tool_allowlist":["exec_command","apply_patch"]},"evaluator":{"artifact_sha256":"e0c6874faec7e84f3c2197a69629d3c058e94389bcd2ce944097d7184a35df5c","version":"public-proxy-auth-assertion.v1"},"experiment_id":"phase3b-swe-evo-calibration-final","goal":{"constraints":["Do not read benchmark gold patches or evaluator-only state.","Keep changes inside requests/ and tests/.","Do not merge or push the candidate change."],"summary":"Requests 2.27.0 has a proxy URL parsing defect: the auth component is dropped from proxy URLs. Diagnose and fix the defect, add or update focused tests where appropriate, and keep the change narrowly scoped."},"instance_id":"psf__requests_v2.27.0_v2.27.1","mode_instructions":{"agentteam_direct":["Use only the preregistered taskpack."],"agentteam_full":["Author and freeze a fresh taskpack from the public goal."],"single_codex":["Solve the public goal directly in this clean repository."]},"mode_order":["single_codex","agentteam_direct","agentteam_full"],"modes":["single_codex","agentteam_direct","agentteam_full"],"operator_limits":{"corrective_intervention":0,"decision_escalation":0,"expected_operator_action":0},"repetition_policy":{"count":1,"order_strategy":"seeded_counterbalanced_rotation"},"repository":{"commit":"0192aac24123735b3eaf9b08df46429bb770c283","git_object_format":"sha1","source":"/tmp/agentteam-swe-evo-requests-source","tree":"94369dd609f8ae984d2397ca8bde82369e348a60"},"schema_version":"experiment_protocol.v1","scored":false,"seed":29,"usage_contract_version":"model_invocation_usage.v1"}
